school_name,school_district,city_name,county_name,zip_code,graduation_rate,date_reported,latitude,longitude,population
CROSBYTON SECONDARY,CROSBYTON CISD,CROSBYTON,Crosby,79322,80,9/23/2019,33.65766,-101.18732,2022
LOVEJOY H S,LOVEJOY ISD,ALLEN,Collin,75002,99,9/23/2019,33.08965,-96.60752,71253
SPUR SCHOOL,SPUR ISD,SPUR,Dickens,79370,80,9/23/2019,33.50304,-100.90344,1594
CELINA H S,CELINA ISD,CELINA,Collin,75009,95,9/23/2019,33.34028,-96.75033,14089
ROCKSPRINGS K-12,ROCKSPRINGS ISD,ROCKSPRINGS,Edwards,78880,80,9/23/2019,29.97978,-100.28849,1626
PANTHER CREEK SCHOOL,PANTHER CREEK CISD,VALERA,Coleman,76884,80,9/23/2019,31.73031,-99.55324,115
POR VIDA ACADEMY CHARTER H S,POR VIDA ACADEMY,SAN ANTONIO,Bexar,78210,35,9/23/2019,29.39601,-98.46437,37683
CORPUS CHRISTI COLLEGE PREP H S,POR VIDA ACADEMY,SAN ANTONIO,Bexar,78210,80,9/23/2019,29.39601,-98.46437,37683
CESAR E CHAVEZ ACADEMY,POR VIDA ACADEMY,SAN ANTONIO,Bexar,78210,35,9/23/2019,29.39601,-98.46437,37683
ALLEN H S,ALLEN ISD,ALLEN,Collin,75013,96,9/23/2019,33.11467,-96.69411,42629
COPPELL H S,COPPELL ISD,COPPELL,Dallas,75019,98,9/23/2019,32.96329,-96.98553,42888
NEW TECH H S AT COPPELL,COPPELL ISD,COPPELL,Dallas,75019,95,9/23/2019,32.96329,-96.98553,42888
BLACKWELL SCHOOL,BLACKWELL CISD,BLACKWELL,Nolan,79506,50,9/23/2019,32.11798,-100.32345,626
DENISON H S,DENISON ISD,DENISON,Grayson,75020,91,9/23/2019,33.77165,-96.60414,23232
PATHWAYS H S,DENISON ISD,DENISON,Grayson,75020,90,9/23/2019,33.77165,-96.60414,23232
ASPERMONT H S,ASPERMONT ISD,ASPERMONT,Stonewall,79502,50,9/23/2019,33.17852,-100.24898,1305
ALVARADO H S,ALVARADO ISD,ALVARADO,Johnson,76009,95,9/23/2019,32.4158,-97.20169,20417
CHISUM H S,CHISUM ISD,PARIS,Lamar,75462,95,9/23/2019,33.62386,-95.48378,11641
DRIPPING SPRINGS H S,DRIPPING SPRINGS ISD,DRIPPING SPRINGS,Hays,78620,98,9/23/2019,30.21895,-98.12894,17590
DALLAS CAN ACADEMY CHARTER,TEXANS CAN ACADEMIES,DALLAS,Dallas,75208,47,9/23/2019,32.75376,-96.83984,29706
DALLAS CAN ACADEMY CHARTER-OAK CLIFF,TEXANS CAN ACADEMIES,DALLAS,Dallas,75208,62,9/23/2019,32.75376,-96.83984,29706
HOUSTON CAN ACADEMY - NORTH,TEXANS CAN ACADEMIES,DALLAS,Dallas,75208,39,9/23/2019,32.75376,-96.83984,29706
SAN ANTONIO CAN ACADEMY,TEXANS CAN ACADEMIES,DALLAS,Dallas,75208,45,9/23/2019,32.75376,-96.83984,29706
FORT WORTH CAN ACADEMY WESTCREEK,TEXANS CAN ACADEMIES,DALLAS,Dallas,75208,45,9/23/2019,32.75376,-96.83984,29706
FORT WORTH CAN ACADEMY LANCASTER AVENUE,TEXANS CAN ACADEMIES,DALLAS,Dallas,75208,31,9/23/2019,32.75376,-96.83984,29706
AUSTIN CAN ACADEMY,TEXANS CAN ACADEMIES,DALLAS,Dallas,75208,43,9/23/2019,32.75376,-96.83984,29706
DALLAS CAN ACADEMY AT CARROLLTON-FARMERS BRANCH,TEXANS CAN ACADEMIES,DALLAS,Dallas,75208,45,9/23/2019,32.75376,-96.83984,29706
HOUSTON CAN ACADEMY - HOBBY,TEXANS CAN ACADEMIES,DALLAS,Dallas,75208,25,9/23/2019,32.75376,-96.83984,29706
DALLAS CAN ACADEMY AT PLEASANT GROVE,TEXANS CAN ACADEMIES,DALLAS,Dallas,75208,37,9/23/2019,32.75376,-96.83984,29706
DALLAS CAN ACADEMY - GRANT EAST,TEXANS CAN ACADEMIES,DALLAS,Dallas,75208,42,9/23/2019,32.75376,-96.83984,29706
WIMBERLEY H S,WIMBERLEY ISD,WIMBERLEY,Hays,78676,95,9/23/2019,30.03286,-98.14588,13124
JACK C HAYS H S,HAYS CISD,KYLE,Hays,78640,90,9/23/2019,29.99495,-97.82813,58790
LIVE OAK ACADEMY,HAYS CISD,KYLE,Hays,78640,90,9/23/2019,29.99495,-97.82813,58790
LEHMAN H S,HAYS CISD,KYLE,Hays,78640,86,9/23/2019,29.99495,-97.82813,58790
GEORGE GERVIN ACADEMY,GEORGE GERVIN ACADEMY,SAN ANTONIO,Bexar,78218,90,9/23/2019,29.49152,-98.40114,37281
FRISCO H S,FRISCO ISD,FRISCO,Denton,75034,98,9/23/2019,33.15195,-96.86036,108525
CENTENNIAL H S,FRISCO ISD,FRISCO,Denton,75034,98,9/23/2019,33.15195,-96.86036,108525
WAKELAND H S,FRISCO ISD,FRISCO,Denton,75034,99,9/23/2019,33.15195,-96.86036,108525
LIBERTY H S,FRISCO ISD,FRISCO,Denton,75034,97,9/23/2019,33.15195,-96.86036,108525
HERITAGE H S,FRISCO ISD,FRISCO,Denton,75034,98,9/23/2019,33.15195,-96.86036,108525
LONE STAR H S,FRISCO ISD,FRISCO,Denton,75034,99,9/23/2019,33.15195,-96.86036,108525
INDEPENDENCE H S,FRISCO ISD,FRISCO,Denton,75034,99,9/23/2019,33.15195,-96.86036,108525
GEORGE I SANCHEZ H S,GEORGE I SANCHEZ CHARTER,HOUSTON,Harris,77023,75,9/23/2019,29.72163,-95.31846,29138
RAUL YZAGUIRRE SCHOOL FOR SUCCESS,RAUL YZAGUIRRE SCHOOL FOR SUCCESS,HOUSTON,Harris,77017,90,9/23/2019,29.68995,-95.25224,32985
UPLIFT EDUCATION-NORTH HILLS PREP H S,UPLIFT EDUCATION,IRVING,Dallas,75039,95,9/23/2019,32.88753,-96.94224,20108
WINFREE ACADEMY CHARTER SCHOOL (RICHARDSON),WINFREE ACADEMY CHARTER SCHOOLS,IRVING,Dallas,75039,40,9/23/2019,32.88753,-96.94224,20108
WINFREE ACADEMY CHARTER SCHOOL (IRVING),WINFREE ACADEMY CHARTER SCHOOLS,IRVING,Dallas,75039,30,9/23/2019,32.88753,-96.94224,20108
WINFREE ACADEMY CHARTER SCHOOL (LEWISVILLE),WINFREE ACADEMY CHARTER SCHOOLS,IRVING,Dallas,75039,30,9/23/2019,32.88753,-96.94224,20108
WINFREE ACADEMY CHARTER SCHOOL - GRAND PRAIRIE,WINFREE ACADEMY CHARTER SCHOOLS,IRVING,Dallas,75039,40,9/23/2019,32.88753,-96.94224,20108
WINFREE ACADEMY NORTH RICHLAND HILLS,WINFREE ACADEMY CHARTER SCHOOLS,IRVING,Dallas,75039,35,9/23/2019,32.88753,-96.94224,20108
WINFREE ACADEMY CHARTER SCHOOL DALLAS,WINFREE ACADEMY CHARTER SCHOOLS,IRVING,Dallas,75039,10,9/23/2019,32.88753,-96.94224,20108
DR M L GARZA-GONZALEZ CHARTER SCHOOL,DR M L GARZA-GONZALEZ CHARTER SCHOOL,CORPUS CHRISTI,Nueces,78416,87,9/23/2019,27.75202,-97.43651,15973
PEGASUS CHARTER H S,PEGASUS SCHOOL OF LIBERAL ARTS AND SCIENCES,DALLAS,Dallas,75201,80,9/23/2019,32.78773,-96.79936,17476
DAVINCI SCHOOL FOR SCIENCE AND THE ARTS,BURNHAM WOOD CHARTER SCHOOL DISTRICT,EL PASO,El Paso,79912,80,9/23/2019,31.84821,-106.53264,78267
GARLAND AEC,GARLAND ISD,GARLAND,Dallas,75042,87,9/23/2019,32.9139,-96.67493,39183
PATHFINDER ACHIEVEMENT CENTER,GARLAND ISD,GARLAND,Dallas,75042,87,9/23/2019,32.9139,-96.67493,39183
GARLAND H S,GARLAND ISD,GARLAND,Dallas,75042,89,9/23/2019,32.9139,-96.67493,39183
LAKEVIEW CENTENNIAL H S,GARLAND ISD,GARLAND,Dallas,75042,93,9/23/2019,32.9139,-96.67493,39183
N GARLAND H S,GARLAND ISD,GARLAND,Dallas,75042,92,9/23/2019,32.9139,-96.67493,39183
S GARLAND H S,GARLAND ISD,GARLAND,Dallas,75042,89,9/23/2019,32.9139,-96.67493,39183
MEMORIAL PATHWAY ACADEMY H S,GARLAND ISD,GARLAND,Dallas,75042,85,9/23/2019,32.9139,-96.67493,39183
NAAMAN FOREST H S,GARLAND ISD,GARLAND,Dallas,75042,89,9/23/2019,32.9139,-96.67493,39183
ROWLETT H S,GARLAND ISD,GARLAND,Dallas,75042,94,9/23/2019,32.9139,-96.67493,39183
SACHSE H S,GARLAND ISD,GARLAND,Dallas,75042,95,9/23/2019,32.9139,-96.67493,39183
ADVANTAGE ACADEMY,ADVANTAGE ACADEMY,DALLAS,Dallas,75116,80,9/23/2019,32.66017,-96.91393,19867
PAUL AND JANE MEYER PUBLIC H S,RAPOPORT ACADEMY PUBLIC SCHOOL,WACO,McLennan,76704,90,9/23/2019,31.57676,-97.127,7956
SCI-TECH PREPARATORY,WAYSIDE SCHOOLS,AUSTIN,Travis,78745,80,9/23/2019,30.20686,-97.79738,61907
THOMAS BUZBEE VOCATIONAL SCHOOL,RAVEN SCHOOL,NEW WAVERLY,Walker,77358,15,9/23/2019,30.55776,-95.43502,5565
HARRIS COUNTY YOUTH VILLAGE,EXCEL ACADEMY,HOUSTON,Harris,77002,87,9/23/2019,29.75641,-95.3653,15613
JHW INSPIRE ACADEMY - HAYS COUNTY,INSPIRE ACADEMIES,SAN ANTONIO,Bexar,78230,87,9/23/2019,29.54613,-98.55552,45021
GUNTER H S,GUNTER ISD,GUNTER,Grayson,75058,90,9/23/2019,33.45012,-96.74225,2666
LIFE SCHOOL OAK CLIFF,LIFE SCHOOL,LANCASTER,Dallas,75146,95,9/23/2019,32.57462,-96.75068,19701
NYOS CHARTER SCHOOL,NYOS CHARTER SCHOOL,AUSTIN,Travis,78753,90,9/23/2019,30.38205,-97.67361,60426
POSITIVE SOLUTIONS CHARTER,POSITIVE SOLUTIONS CHARTER SCHOOL,SAN ANTONIO,Bexar,78212,30,9/23/2019,29.46463,-98.49266,28865
UNIVERSAL ACADEMY,UNIVERSAL ACADEMY,IRVING,Dallas,75062,50,9/23/2019,32.84702,-96.95686,49306
UNIVERSAL ACADEMY - COPPELL,UNIVERSAL ACADEMY,IRVING,Dallas,75062,87,9/23/2019,32.84702,-96.95686,49306
MILTON B LEE ACADEMY OF SCIENCE & ENGINEERING,SCHOOL OF EXCELLENCE IN EDUCATION,SAN ANTONIO,Bexar,78213,90,9/23/2019,29.51693,-98.52359,44813
LAKE DALLAS H S,LAKE DALLAS ISD,LAKE DALLAS,Denton,75065,98,9/23/2019,33.11093,-97.0119,12640
SOUTHWEST PREPARATORY SOUTHEAST CAMPUS,SOUTHWEST PREPARATORY SCHOOL,SAN ANTONIO,Bexar,78209,50,9/23/2019,29.48907,-98.4567,42653
SOUTHWEST PREPARATORY SCHOOL-NORTHWEST,SOUTHWEST PREPARATORY SCHOOL,SAN ANTONIO,Bexar,78209,80,9/23/2019,29.48907,-98.4567,42653
NEW DIRECTIONS,SOUTHWEST PREPARATORY SCHOOL,SAN ANTONIO,Bexar,78209,80,9/23/2019,29.48907,-98.4567,42653
LEWISVILLE H S,LEWISVILLE ISD,LEWISVILLE,Denton,75067,92,9/23/2019,33.01371,-97.00025,68196
MARCUS H S,LEWISVILLE ISD,LEWISVILLE,Denton,75067,98,9/23/2019,33.01371,-97.00025,68196
THE COLONY H S,LEWISVILLE ISD,LEWISVILLE,Denton,75067,96,9/23/2019,33.01371,-97.00025,68196
LEARNING CTR,LEWISVILLE ISD,LEWISVILLE,Denton,75067,71,9/23/2019,33.01371,-97.00025,68196
DENTON CO J J A E P,LEWISVILLE ISD,LEWISVILLE,Denton,75067,87,9/23/2019,33.01371,-97.00025,68196
HEBRON H S,LEWISVILLE ISD,LEWISVILLE,Denton,75067,96,9/23/2019,33.01371,-97.00025,68196
FLOWER MOUND H S,LEWISVILLE ISD,LEWISVILLE,Denton,75067,99,9/23/2019,33.01371,-97.00025,68196
CHAPARRAL STAR ACADEMY,CHAPARRAL STAR ACADEMY,AUSTIN,Travis,78728,80,9/23/2019,30.45654,-97.68986,21125
TEMPLE CHARTER ACADEMY,PRIORITY CHARTER SCHOOLS,LITTLE ELM,Denton,75068,50,9/23/2019,33.17647,-96.95053,65991
CEDAR PARK CHARTER ACADEMY,PRIORITY CHARTER SCHOOLS,LITTLE ELM,Denton,75068,50,9/23/2019,33.17647,-96.95053,65991
COVE CHARTER ACADEMY,PRIORITY CHARTER SCHOOLS,LITTLE ELM,Denton,75068,50,9/23/2019,33.17647,-96.95053,65991
TREETOPS SCHOOL INTERNATIONAL,TREETOPS SCHOOL INTERNATIONAL,EULESS,Tarrant,76040,50,9/23/2019,32.8147,-97.0968,31519
LITTLE ELM H S,LITTLE ELM ISD,LITTLE ELM,Denton,75068,95,9/23/2019,33.17647,-96.95053,65991
MCKINNEY H S,MCKINNEY ISD,MCKINNEY,Collin,75069,97,9/23/2019,33.16545,-96.59468,37892
SERENITY HIGH,MCKINNEY ISD,MCKINNEY,Collin,75069,50,9/23/2019,33.16545,-96.59468,37892
COUNTY RESIDENTIAL CENTER,MCKINNEY ISD,MCKINNEY,Collin,75069,87,9/23/2019,33.16545,-96.59468,37892
MCKINNEY NORTH H S,MCKINNEY ISD,MCKINNEY,Collin,75069,98,9/23/2019,33.16545,-96.59468,37892
MCKINNEY BOYD H S,MCKINNEY ISD,MCKINNEY,Collin,75069,97,9/23/2019,33.16545,-96.59468,37892
PINEYWOODS COMMUNITY ACADEMY H S,PINEYWOODS COMMUNITY ACADEMY,LUFKIN,Angelina,75904,90,9/23/2019,31.3397,-94.82173,34406
RICHARD MILBURN ALTER H S (KILLEEN),RICHARD MILBURN ALTER HIGH SCHOOL (KILLEEN),MCQUEENEY,Guadalupe,78123,35,9/23/2019,29.6024,-98.04405,2177
RICHARD MILBURN ACADEMY LUBBOCK,RICHARD MILBURN ALTER HIGH SCHOOL (KILLEEN),MCQUEENEY,Guadalupe,78123,30,9/23/2019,29.6024,-98.04405,2177
RICHARD MILBURN ACADEMY CORPUS CHRISTI,RICHARD MILBURN ALTER HIGH SCHOOL (KILLEEN),MCQUEENEY,Guadalupe,78123,24,9/23/2019,29.6024,-98.04405,2177
RICHARD MILBURN ACADEMY AMARILLO,RICHARD MILBURN ALTER HIGH SCHOOL (KILLEEN),MCQUEENEY,Guadalupe,78123,45,9/23/2019,29.6024,-98.04405,2177
RICHARD MILBURN ACADEMY FORT WORTH,RICHARD MILBURN ALTER HIGH SCHOOL (KILLEEN),MCQUEENEY,Guadalupe,78123,25,9/23/2019,29.6024,-98.04405,2177
RICHARD MILBURN ACADEMY ODESSA,RICHARD MILBURN ALTER HIGH SCHOOL (KILLEEN),MCQUEENEY,Guadalupe,78123,25,9/23/2019,29.6024,-98.04405,2177
RICHARD MILBURN ACADEMY HOUSTON (SUBURBAN),RICHARD MILBURN ALTER HIGH SCHOOL (KILLEEN),MCQUEENEY,Guadalupe,78123,20,9/23/2019,29.6024,-98.04405,2177
HARMONY SCIENCE ACADEMY-HOUSTON,HARMONY SCIENCE ACADEMY,HOUSTON,Harris,77099,95,9/23/2019,29.67079,-95.58519,52294
HARMONY SCHOOL OF INGENUITY-HOUSTON,HARMONY SCIENCE ACADEMY,HOUSTON,Harris,77099,95,9/23/2019,29.67079,-95.58519,52294
HARMONY SCIENCE ACADEMY-PFLUGERVILLE,HARMONY SCIENCE ACADEMY (AUSTIN),HOUSTON,Harris,77099,95,9/23/2019,29.67079,-95.58519,52294
HARMONY SCHOOL OF EXCELLENCE - AUSTIN,HARMONY SCIENCE ACADEMY (AUSTIN),HOUSTON,Harris,77099,90,9/23/2019,29.67079,-95.58519,52294
HARMONY SCHOOL OF POLITICAL SCIENCE & COMM-AUSTIN,HARMONY SCIENCE ACADEMY (AUSTIN),HOUSTON,Harris,77099,50,9/23/2019,29.67079,-95.58519,52294
HARMONY SCIENCE ACAD (SAN ANTONIO),HARMONY SCIENCE ACAD (SAN ANTONIO),HOUSTON,Harris,77099,95,9/23/2019,29.67079,-95.58519,52294
HARMONY SCIENCE ACAD (EL PASO),HARMONY SCIENCE ACAD (EL PASO),HOUSTON,Harris,77099,90,9/23/2019,29.67079,-95.58519,52294
HARMONY SCHOOL OF INNOVATION - EL PASO,HARMONY SCIENCE ACAD (EL PASO),HOUSTON,Harris,77099,80,9/23/2019,29.67079,-95.58519,52294
HARMONY SCHOOL OF DISCOVERY - HOUSTON,HARMONY SCHOOL OF EXCELLENCE,HOUSTON,Harris,77099,90,9/23/2019,29.67079,-95.58519,52294
HARMONY SCHOOL OF ADVANCEMENT-HOUSTON,HARMONY SCHOOL OF EXCELLENCE,HOUSTON,Harris,77099,95,9/23/2019,29.67079,-95.58519,52294
HARMONY SCIENCE ACADEMY - EULESS,HARMONY SCIENCE ACAD (WACO),HOUSTON,Harris,77099,80,9/23/2019,29.67079,-95.58519,52294
HARMONY SCIENCE ACADEMY - DALLAS,HARMONY SCIENCE ACAD (WACO),HOUSTON,Harris,77099,95,9/23/2019,29.67079,-95.58519,52294
HARMONY SCHOOL OF NATURE AND ATHLETICS - DALLAS,HARMONY SCIENCE ACAD (WACO),HOUSTON,Harris,77099,95,9/23/2019,29.67079,-95.58519,52294
HARMONY SCHOOL OF INNOVATION - FORT WORTH,HARMONY SCIENCE ACAD (WACO),HOUSTON,Harris,77099,90,9/23/2019,29.67079,-95.58519,52294
HARMONY SCHOOL OF INNOVATION - GARLAND,HARMONY SCIENCE ACAD (WACO),HOUSTON,Harris,77099,90,9/23/2019,29.67079,-95.58519,52294
HERITAGE ACADEMY OF DEL RIO,HERITAGE ACADEMY,SCHERTZ,Guadalupe,78154,80,9/23/2019,29.54622,-98.26627,41272
DALLAS COUNTY JUVENILE JUSTICE,ACADEMY FOR ACADEMIC EXCELLENCE,DALLAS,Dallas,75212,87,9/23/2019,32.78142,-96.87913,26720
SAU CAMPUS,ACADEMY FOR ACADEMIC EXCELLENCE,DALLAS,Dallas,75212,20,9/23/2019,32.78142,-96.87913,26720
DRC CAMPUS,ACADEMY FOR ACADEMIC EXCELLENCE,DALLAS,Dallas,75212,10,9/23/2019,32.78142,-96.87913,26720
HARMONY SCHOOL OF INNOVATION-SUGAR LAND,HARMONY SCHOOL OF SCIENCE - HOUSTON,HOUSTON,Harris,77099,95,9/23/2019,29.67079,-95.58519,52294
HARMONY SCIENCE ACADEMY- BEAUMONT,HARMONY SCHOOL OF SCIENCE - HOUSTON,HOUSTON,Harris,77099,90,9/23/2019,29.67079,-95.58519,52294
PASO DEL NORTE ACADEMY-MESA CHARTER H S,PASO DEL NORTE ACADEMY CHARTER DISTRICT,SAN ANTONIO,Bexar,78212,40,9/23/2019,29.46463,-98.49266,28865
PASEO DEL NORTE ACADEMY-VISTA DEL SOL CHARTER HIGH,PASO DEL NORTE ACADEMY CHARTER DISTRICT,SAN ANTONIO,Bexar,78212,40,9/23/2019,29.46463,-98.49266,28865
DAN CHADWICK CAMPUS,EAST TEXAS CHARTER SCHOOLS,LONGVIEW,Gregg,75601,90,9/23/2019,32.50856,-94.72383,15719
LANCASTER H S,LANCASTER ISD,LANCASTER,Dallas,75146,99,9/23/2019,32.57462,-96.75068,19701
HOUSTON HEIGHTS CHARTER SCHOOL,HOUSTON HEIGHTS HIGH SCHOOL,HOUSTON,Harris,77008,70,9/23/2019,29.7986,-95.41754,34895
HOUSTON GATEWAY ACADEMY - CORAL CAMPUS,HOUSTON GATEWAY ACADEMY INC,HOUSTON,Harris,77087,95,9/23/2019,29.68613,-95.30343,37886
CALVIN NELMS H S,CALVIN NELMS CHARTER SCHOOLS,KATY,Harris,77449,80,9/23/2019,29.83556,-95.73813,128294
EMPOWERMENT H S,SOUTHWEST SCHOOL,HOUSTON,Harris,77057,90,9/23/2019,29.74546,-95.48868,41690
PHOENIX SCHOOL AT SOUTHWEST SCHOOLS,SOUTHWEST SCHOOL,HOUSTON,Harris,77057,60,9/23/2019,29.74546,-95.48868,41690
COMQUEST ACADEMY,COMQUEST ACADEMY,TOMBALL,Harris,77375,87,9/23/2019,30.09544,-95.5894,55759
KATHERINE ANNE PORTER SCHOOL,KATHERINE ANNE PORTER SCHOOL,WIMBERLEY,Hays,78676,80,9/23/2019,30.03286,-98.14588,13124
EVOLUTION ACADEMY CHARTER SCHOOL,EVOLUTION ACADEMY CHARTER SCHOOL,RICHARDSON,Dallas,75081,39,9/23/2019,32.94882,-96.7102,40265
EVOLUTION ACADEMY HOUSTON,EVOLUTION ACADEMY CHARTER SCHOOL,RICHARDSON,Dallas,75081,20,9/23/2019,32.94882,-96.7102,40265
EVOLUTION ACADEMY BEAUMONT,EVOLUTION ACADEMY CHARTER SCHOOL,RICHARDSON,Dallas,75081,45,9/23/2019,32.94882,-96.7102,40265
MIDVALLEY ACADEMY-MERCEDES CHARTER H S,MIDVALLEY ACADEMY CHARTER DISTRICT,SAN ANTONIO,Bexar,78212,60,9/23/2019,29.46463,-98.49266,28865
MIDVALLEY ACADEMY-MCALLEN CHARTER H S,MIDVALLEY ACADEMY CHARTER DISTRICT,SAN ANTONIO,Bexar,78212,60,9/23/2019,29.46463,-98.49266,28865
MIDVALLEY ACADEMY-SAN BENITO CHARTER H S,MIDVALLEY ACADEMY CHARTER DISTRICT,SAN ANTONIO,Bexar,78212,85,9/23/2019,29.46463,-98.49266,28865
TEKOA ACADEMY OF ACCELERATED STUDIES,TEKOA ACADEMY OF ACCELERATED STUDIES STEM SCHOOL,PORT ARTHUR,Jefferson,77640,50,9/23/2019,29.88111,-93.94105,15706
SOUTH PLAINS ACADEMY CHARTER H S,SOUTH PLAINS ACADEMY CHARTER DISTRICT,SAN ANTONIO,Bexar,78212,75,9/23/2019,29.46463,-98.49266,28865
HUSTON ACADEMY,ERATH EXCELS ACADEMY INC,STEPHENVILLE,Erath,76401,80,9/23/2019,32.28258,-98.19881,30003
SHORELINE ACADEMY,ERATH EXCELS ACADEMY INC,STEPHENVILLE,Erath,76401,50,9/23/2019,32.28258,-98.19881,30003
RANCH ACADEMY,RANCH ACADEMY,CANTON,Van Zandt,75103,50,9/23/2019,32.51192,-95.88235,14530
CANTON H S,CANTON ISD,CANTON,Van Zandt,75103,95,9/23/2019,32.51192,-95.88235,14530
HUDSON H S,HUDSON ISD,LUFKIN,Angelina,75904,95,9/23/2019,31.3397,-94.82173,34406
STUBBLEFIELD LRN CTR,HUDSON ISD,LUFKIN,Angelina,75904,40,9/23/2019,31.3397,-94.82173,34406
CEDAR HILL H S,CEDAR HILL ISD,CEDAR HILL,Dallas,75104,93,9/23/2019,32.58042,-96.96613,49171
CEDAR HILL COLLEGIATE H S,CEDAR HILL ISD,CEDAR HILL,Dallas,75104,95,9/23/2019,32.58042,-96.96613,49171
GATEWAY ACADEMY-TOWNLAKE CHARTER H S,GATEWAY ACADEMY CHARTER DISTRICT,LAREDO,Webb,78041,50,9/23/2019,27.55417,-99.46337,47753
GATEWAY ACADEMY-SIERRA VISTA CHARTER H S,GATEWAY ACADEMY CHARTER DISTRICT,LAREDO,Webb,78041,80,9/23/2019,27.55417,-99.46337,47753
JUBILEE SAN ANTONIO,JUBILEE ACADEMIES,SAN ANTONIO,Bexar,78222,90,9/23/2019,29.36614,-98.37783,25227
GATEWAY CHARTER ACADEMY - MIDDLE - H S,GATEWAY CHARTER ACADEMY,DALLAS,Dallas,75241,90,9/23/2019,32.66571,-96.75904,31562
VANGUARD REMBRANDT,VANGUARD ACADEMY,PHARR,Hidalgo,78577,95,9/23/2019,26.15047,-98.19104,78103
MILDRED H S,MILDRED ISD,CORSICANA,Navarro,75109,90,9/23/2019,32.04523,-96.35405,4384
CORSICANA H IGH SCHOOL,CORSICANA ISD,CORSICANA,Navarro,75110,93,9/23/2019,32.08693,-96.52879,28558
CRANDALL H S,CRANDALL ISD,CRANDALL,Kaufman,75114,98,9/23/2019,32.61016,-96.44553,6829
CRANDALL COMPASS ACADEMY,CRANDALL ISD,CRANDALL,Kaufman,75114,90,9/23/2019,32.61016,-96.44553,6829
INSPIRED VISION ACADEMY MIDDLE,INSPIRED VISION ACADEMY,DALLAS,Dallas,75227,95,9/23/2019,32.77,-96.68728,59924
EL PASO ACADEMY,EL PASO ACADEMY,EL PASO,El Paso,79935,50,9/23/2019,31.76795,-106.33019,17850
EL PASO ACADEMY WEST,EL PASO ACADEMY,EL PASO,El Paso,79935,70,9/23/2019,31.76795,-106.33019,17850
PREMIER H S SAN ANTONIO EAST,PREMIER HIGH SCHOOLS,DUBLIN,Erath,76446,40,9/23/2019,32.0752,-98.34943,7709
PREMIER H S OF BROWNSVILLE,PREMIER HIGH SCHOOLS,DUBLIN,Erath,76446,20,9/23/2019,32.0752,-98.34943,7709
PREMIER H S OF PHARR,PREMIER HIGH SCHOOLS,DUBLIN,Erath,76446,40,9/23/2019,32.0752,-98.34943,7709
PREMIER H S AMERICAN YOUTHWORKS,PREMIER HIGH SCHOOLS,DUBLIN,Erath,76446,21,9/23/2019,32.0752,-98.34943,7709
PREMIER H S OF LUBBOCK,PREMIER HIGH SCHOOLS,DUBLIN,Erath,76446,60,9/23/2019,32.0752,-98.34943,7709
PREMIER H S OF WACO,PREMIER HIGH SCHOOLS,DUBLIN,Erath,76446,50,9/23/2019,32.0752,-98.34943,7709
PREMIER H S OF MIDLAND,PREMIER HIGH SCHOOLS,DUBLIN,Erath,76446,50,9/23/2019,32.0752,-98.34943,7709
PREMIER H S OF TYLER,PREMIER HIGH SCHOOLS,DUBLIN,Erath,76446,21,9/23/2019,32.0752,-98.34943,7709
PREMIER H S OF FORT WORTH,PREMIER HIGH SCHOOLS,DUBLIN,Erath,76446,20,9/23/2019,32.0752,-98.34943,7709
PREMIER H S OF ABILENE,PREMIER HIGH SCHOOLS,DUBLIN,Erath,76446,60,9/23/2019,32.0752,-98.34943,7709
PREMIER H S OF DEL RIO,PREMIER HIGH SCHOOLS,DUBLIN,Erath,76446,20,9/23/2019,32.0752,-98.34943,7709
PREMIER H S OF LAREDO,PREMIER HIGH SCHOOLS,DUBLIN,Erath,76446,30,9/23/2019,32.0752,-98.34943,7709
PREMIER H S OF COMANCHE/EARLY,PREMIER HIGH SCHOOLS,DUBLIN,Erath,76446,60,9/23/2019,32.0752,-98.34943,7709
PREMIER H S OF AUSTIN,PREMIER HIGH SCHOOLS,DUBLIN,Erath,76446,40,9/23/2019,32.0752,-98.34943,7709
PREMIER H S OF MISSION,PREMIER HIGH SCHOOLS,DUBLIN,Erath,76446,50,9/23/2019,32.0752,-98.34943,7709
PREMIER H S OF PALMVIEW,PREMIER HIGH SCHOOLS,DUBLIN,Erath,76446,50,9/23/2019,32.0752,-98.34943,7709
PREMIER H S OF NORTH AUSTIN,PREMIER HIGH SCHOOLS,DUBLIN,Erath,76446,60,9/23/2019,32.0752,-98.34943,7709
PREMIER H S OF EL PASO,PREMIER HIGH SCHOOLS,DUBLIN,Erath,76446,40,9/23/2019,32.0752,-98.34943,7709
PREMIER H S OF SAN JUAN,PREMIER HIGH SCHOOLS,DUBLIN,Erath,76446,60,9/23/2019,32.0752,-98.34943,7709
PREMIER H S OF NEW BRAUNFELS,PREMIER HIGH SCHOOLS,DUBLIN,Erath,76446,60,9/23/2019,32.0752,-98.34943,7709
PREMIER H S OF ARLINGTON,PREMIER HIGH SCHOOLS,DUBLIN,Erath,76446,21,9/23/2019,32.0752,-98.34943,7709
PREMIER H S OF HUNTSVILLE,PREMIER HIGH SCHOOLS,DUBLIN,Erath,76446,40,9/23/2019,32.0752,-98.34943,7709
PREMIER H S OF GRANBURY,PREMIER HIGH SCHOOLS,DUBLIN,Erath,76446,70,9/23/2019,32.0752,-98.34943,7709
PREMIER H S OF SOUTH IRVING,PREMIER HIGH SCHOOLS,DUBLIN,Erath,76446,60,9/23/2019,32.0752,-98.34943,7709
PREMIER H S OF DAYTON,PREMIER HIGH SCHOOLS,DUBLIN,Erath,76446,90,9/23/2019,32.0752,-98.34943,7709
PREMIER H S OF AMARILLO,PREMIER HIGH SCHOOLS,DUBLIN,Erath,76446,30,9/23/2019,32.0752,-98.34943,7709
PREMIER H S OF LEWISVILLE,PREMIER HIGH SCHOOLS,DUBLIN,Erath,76446,40,9/23/2019,32.0752,-98.34943,7709
DESOTO H S & ISTEAM3D,DESOTO ISD,DESOTO,Dallas,75115,94,9/23/2019,32.59888,-96.86374,52916
EDGEWOOD H S,EDGEWOOD ISD,EDGEWOOD,Van Zandt,75117,95,9/23/2019,32.71183,-95.85077,3984
EUSTACE H S,EUSTACE ISD,EUSTACE,Henderson,75124,95,9/23/2019,32.32673,-95.9724,4255
FERRIS H S,FERRIS ISD,FERRIS,Ellis,75125,95,9/23/2019,32.53137,-96.62477,6326
FORNEY H S,FORNEY ISD,FORNEY,Kaufman,75126,98,9/23/2019,32.74205,-96.45185,48987
NORTH FORNEY H S,FORNEY ISD,FORNEY,Kaufman,75126,97,9/23/2019,32.74205,-96.45185,48987
FRUITVALE H S,FRUITVALE ISD,FRUITVALE,Van Zandt,75127,80,9/23/2019,32.69116,-95.79336,1705
CADDO MILLS H S,CADDO MILLS ISD,CADDO MILLS,Hunt,75135,95,9/23/2019,33.06521,-96.22289,7363
DUNCANVILLE H S,DUNCANVILLE ISD,DUNCANVILLE,Dallas,75137,96,9/23/2019,32.634,-96.91176,19548
MARY E SMITHEY PACE H S,DUNCANVILLE ISD,DUNCANVILLE,Dallas,75137,65,9/23/2019,32.634,-96.91176,19548
GRAND SALINE H S,GRAND SALINE ISD,GRAND SALINE,Van Zandt,75140,95,9/23/2019,32.64691,-95.69145,7595
KAUFMAN H S,KAUFMAN ISD,KAUFMAN,Kaufman,75142,99,9/23/2019,32.57357,-96.24717,19261
GARY W CAMPBELL H S,KAUFMAN ISD,KAUFMAN,Kaufman,75142,60,9/23/2019,32.57357,-96.24717,19261
KEMP H S,KEMP ISD,KEMP,Henderson,75143,95,9/23/2019,32.36358,-96.24817,14510
KERENS SCHOOL,KERENS ISD,KERENS,Navarro,75144,90,9/23/2019,32.11313,-96.20885,3668
MABANK H S,MABANK ISD,MABANK,Kaufman,75147,96,9/23/2019,32.43298,-96.0774,6636
YES PREP - SOUTHEAST,YES PREP PUBLIC SCHOOLS INC,HOUSTON,Harris,77036,95,9/23/2019,29.70165,-95.53595,74472
YES PREP - NORTH CENTRAL,YES PREP PUBLIC SCHOOLS INC,HOUSTON,Harris,77036,95,9/23/2019,29.70165,-95.53595,74472
YES PREP - SOUTHWEST,YES PREP PUBLIC SCHOOLS INC,HOUSTON,Harris,77036,90,9/23/2019,29.70165,-95.53595,74472
YES PREP - EAST END,YES PREP PUBLIC SCHOOLS INC,HOUSTON,Harris,77036,95,9/23/2019,29.70165,-95.53595,74472
YES PREP - GULFTON,YES PREP PUBLIC SCHOOLS INC,HOUSTON,Harris,77036,90,9/23/2019,29.70165,-95.53595,74472
YES PREP - BRAYS OAKS,YES PREP PUBLIC SCHOOLS INC,HOUSTON,Harris,77036,90,9/23/2019,29.70165,-95.53595,74472
YES PREP - WEST,YES PREP PUBLIC SCHOOLS INC,HOUSTON,Harris,77036,95,9/23/2019,29.70165,-95.53595,74472
YES PREP NORTH FOREST,YES PREP PUBLIC SCHOOLS INC,HOUSTON,Harris,77036,85,9/23/2019,29.70165,-95.53595,74472
CROSS ROADS H S,CROSS ROADS ISD,MALAKOFF,Henderson,75148,90,9/23/2019,32.12461,-96.01216,5961
MALAKOFF H S,MALAKOFF ISD,MALAKOFF,Henderson,75148,90,9/23/2019,32.12461,-96.01216,5961
KILGORE H S,KILGORE ISD,KILGORE,Gregg,75662,95,9/23/2019,32.38397,-94.87014,24976
MESQUITE H S,MESQUITE ISD,MESQUITE,Dallas,75149,90,9/23/2019,32.77003,-96.61487,56473
NORTH MESQUITE H S,MESQUITE ISD,MESQUITE,Dallas,75149,96,9/23/2019,32.77003,-96.61487,56473
WEST MESQUITE H S,MESQUITE ISD,MESQUITE,Dallas,75149,94,9/23/2019,32.77003,-96.61487,56473
POTEET H S,MESQUITE ISD,MESQUITE,Dallas,75149,96,9/23/2019,32.77003,-96.61487,56473
HORN H S,MESQUITE ISD,MESQUITE,Dallas,75149,92,9/23/2019,32.77003,-96.61487,56473
MESQUITE ACADEMY,MESQUITE ISD,MESQUITE,Dallas,75149,45,9/23/2019,32.77003,-96.61487,56473
IDEA COLLEGE PREP,IDEA PUBLIC SCHOOLS,WESLACO,Hidalgo,78596,90,9/23/2019,26.15806,-97.98925,67269
IDEA QUEST COLLEGE PREPARATORY,IDEA PUBLIC SCHOOLS,WESLACO,Hidalgo,78596,95,9/23/2019,26.15806,-97.98925,67269
IDEA FRONTIER COLLEGE PREPARATORY,IDEA PUBLIC SCHOOLS,WESLACO,Hidalgo,78596,95,9/23/2019,26.15806,-97.98925,67269
IDEA COLLEGE PREPARATORY SAN JUAN,IDEA PUBLIC SCHOOLS,WESLACO,Hidalgo,78596,95,9/23/2019,26.15806,-97.98925,67269
IDEA COLLEGE PREPARATORY MISSION,IDEA PUBLIC SCHOOLS,WESLACO,Hidalgo,78596,95,9/23/2019,26.15806,-97.98925,67269
IDEA COLLEGE PREPARATORY SAN BENITO,IDEA PUBLIC SCHOOLS,WESLACO,Hidalgo,78596,95,9/23/2019,26.15806,-97.98925,67269
IDEA COLLEGE PREPARATORY ALAMO,IDEA PUBLIC SCHOOLS,WESLACO,Hidalgo,78596,95,9/23/2019,26.15806,-97.98925,67269
PANOLA CS,PANOLA CHARTER SCHOOL,CARTHAGE,Panola,75633,50,9/23/2019,32.12895,-94.27705,13161
TEXAS EARLY COLLEGE H S,PANOLA CHARTER SCHOOL,CARTHAGE,Panola,75633,80,9/23/2019,32.12895,-94.27705,13161
PANOLA EARLY COLLEGE H S,PANOLA CHARTER SCHOOL,CARTHAGE,Panola,75633,50,9/23/2019,32.12895,-94.27705,13161
BRAZOS RIVER CHARTER SCHOOL,BRAZOS RIVER CHARTER SCHOOL,NEMO,Somervell,76070,55,9/23/2019,32.26241,-97.65424,895
BIG SPRINGS CHARTER SCHOOL,BIG SPRINGS CHARTER SCHOOL,LEAKEY,Real,78873,87,9/23/2019,29.76655,-99.73616,2053
HILL COUNTRY YOUTH RANCH,BIG SPRINGS CHARTER SCHOOL,LEAKEY,Real,78873,50,9/23/2019,29.76655,-99.73616,2053
FORT WORTH ACADEMY OF FINE ARTS,FORT WORTH ACADEMY OF FINE ARTS,FORT WORTH,Tarrant,76109,90,9/23/2019,32.701,-97.38393,23220
GATEWAY TECH H S,ORENDA CHARTER SCHOOL,GEORGETOWN,Williamson,78628,60,9/23/2019,30.64104,-97.75111,35601
GATEWAY COLLEGE PREPARATORY SCHOOL,ORENDA CHARTER SCHOOL,GEORGETOWN,Williamson,78628,90,9/23/2019,30.64104,-97.75111,35601
AUSTIN H S,HOUSTON ISD,HOUSTON,Harris,77092,85,9/23/2019,29.82968,-95.47383,38458
BELLAIRE H S,HOUSTON ISD,HOUSTON,Harris,77092,91,9/23/2019,29.82968,-95.47383,38458
NORTHSIDE H S,HOUSTON ISD,HOUSTON,Harris,77092,79,9/23/2019,29.82968,-95.47383,38458
FURR H S,HOUSTON ISD,HOUSTON,Harris,77092,71,9/23/2019,29.82968,-95.47383,38458
